"date_mdy","journal_entry","location","year","month","longitude","latitude"
1881-01-01,"The wind West North West. and the termometer 10 degrees above zero. On board the Sehr A.G. Brooks with Capt Thomas Smallidge lying at Sr Andruws N. B and loading with frozen herring for Boston. Took in 30000 in morning which finished the load Gor underway 9.30 am got to Eastport at noon set-the Supercargo a show and filled water and went out. at dark flood tide made and anchored in little River","Little River",1881,1,-67.2021180472245,44.6526698980649
1881-01-02,"At one oclock in the morning went out of Little River with the wind very moderate North West and the Thermomemert at 12 above at daylight abrest of Moosepeak. all the forenoon very moderate calm Got abrest of Schoodic Island frost after dark and took the wind from the West and anchord in Winter Harbor at 9 PM","Little River",1881,1,-67.2021180472245,44.6526698980649
1881-01-02,"At one oclock in the morning went out of Little River with the wind very moderate North West and the Thermomemert at 12 above at daylight abrest of Moosepeak. all the forenoon very moderate calm Got abrest of Schoodic Island frost after dark and took the wind from the West and anchord in Winter Harbor at 9 PM","Winter Harbor",1881,1,-68.09811741,44.39116851
1881-01-03,"Calm in morning Got underway in morning at Winter Harbor for Boston The wind breezed ufi from the West fresh breeze Thermometer at 30 degreese slight snow squalls anchored at North East Harbor at 4 oclock in the after noon In the morning cloued rofi","Winter Harbor",1881,1,-68.09811741,44.39116851
1881-01-06,"Anchord at 1 oclock am Wind North East and at 4 oclock in the morning is was snowing very hard and snowed until noon ave lay te an anchorin Portland Rodes. In afternoon drizzling rainThermometer 32 above zero.","Portland",1881,1,-70.310425,43.680031
1881-01-07,"Calm in the morning & at 8.30 oclock A.M. the wind breezed up from the Westward. Got under way passed Cape Elizabeth at 10 stood in shore and when stovel we singlereefed at 4 P.M passed Cape Parpoise at 4 Boon Island at 11.30 PM passed Thatehes Island the wind hauling from the North West and growing cold the vessel ??????????? Thermometer 10 above","Cape Elizabeth",1881,1,-70.20005,43.563698
1881-01-07,"Calm in the morning & at 8.30 oclock A.M. the wind breezed up from the Westward. Got under way passed Cape Elizabeth at 10 stood in shore and when stovel we singlereefed at 4 P.M passed Cape Parpoise at 4 Boon Island at 11.30 PM passed Thatehes Island the wind hauling from the North West and growing cold the vessel ??????????? Thermometer 10 above","Boon Island",1881,1,-70.47166478,43.11916619
1881-01-08,"The wind continue to blow from the North West and at 5 oclock in the morning anchored above Long Island in Boston Harbor. and after Sunrise took a tug boat and towed to Commercial Wharf and took out 32 baskets of herring The Thermometer in the Sun at noon 40 above zero. and at night went doen 15 20 above","Boston Harbor",1881,1,-70.97553,42.337638
1881-01-09,"The wind baffling from North to Easterly and apart after time over east at 9 P.M it was snowing moderately. Thermometer 22 degreese above. Lying at Commercial Wharf ready to dicsharge herring","Boston Harbor",1881,1,-70.97553,42.337638
1881-01-10,"The wind Easterly & heavy rain allday raining from early in the morning untill in the evening. could not take out any herring Thermometer 32 degrees above zero","Boston Harbor",1881,1,-70.97553,42.337638
1881-01-11,"The wind Northerly and wind moderate and the Thermometer 24 high in the forenoon took out 16,000 herring during the day.","Boston Harbor",1881,1,-70.97553,42.337638
1881-01-12,"Wind Northerly and the Thermometer 22 degrees in the morning and went up to 29. took out 20,000 of herring out of the A. G. Brooks.","Boston Harbor",1881,1,-70.97553,42.337638
1881-01-13,"The wind South West. Thermometer 33 degrees high in the shade Took out of the vessel 17,300 herrings Made top for the vessels pump","Boston Harbor",1881,1,-70.97553,42.337638
1881-01-14,"The wind Southerly Thermometer 36 degrees high and over cast took out 12,000 herring In the afternoon rainy put hateheo out  made pump brake at 8 oclock in the Evening wind came of North West and Thermometer fell to freezing.","Boston Harbor",1881,1,-70.97553,42.337638
1881-01-15,"The wind North west Thermometer 11 degrees above zero in the morning Took out of the Schr A. G. Brookss 21,500 herring in the forenoon. In the afternoon done nothing towards discharging and lying along. side of Commercial Wharf Boston.","Boston Harbor",1881,1,-70.97553,42.337638
1881-01-16,"The wind Southerly and moderate Thermometer in the morning being 20 degrees above zero Wrote letter home and to Chicago Lying at Commercial wharf Boston Went to the Seamens Bethel Hanover street in the evening","Boston Harbor",1881,1,-70.97553,42.337638
1881-01-17,"Wind moderate N. W. Thermometer 35 degrees at noon Took out of the Schr AGBrooks 17,400 of herring. In the evening to a Gospell Temperance meeting at the Seamens Bethel on Hanover Street","Boston Harbor",1881,1,-70.97553,42.337638
1881-01-18,"Wind Westerly thermometer 27 Took 15,900 herring out of the Brooks Put fashion piece on Port side of vessel","Boston Harbor",1881,1,-70.97553,42.337638
1881-01-19,"The wind South West Thermometer 32 at 10 oclock in the fore noon got all out the fore hold and commenced snowing cleared up at night got out 14,900 herring","Boston Harbor",1881,1,-70.97553,42.337638
1881-01-20,"The wind N.W. by W. Thermometer 22 and clear Took out 5,600 herring put chock on A.G.Brooks.","Boston Harbor",1881,1,-70.97553,42.337638
1881-01-21,"The wind Easterly and overcast Thermometer 30 degrees Took 20,500 herring out the vessel At noon commenced snowing and put the hatches on no more herring to come out for the day. at night the wind increased to a very heavy gale","Boston Harbor",1881,1,-70.97553,42.337638
1881-01-22,"The wind hauled around from North to West. Took 14,800 herring out of the vessel in forenoon. In the evening went to a Temperanee meeting at the North End missiogs Thermometer 31 above zero.","Boston Harbor",1881,1,-70.97553,42.337638
1881-01-23,"The wind North West Thermometer 24 above zero at night colder Went to Religious meeting at Tremont Temple on Tremont Street","Boston Harbor",1881,1,-70.97553,42.337638
1881-01-24,"Wind North Westerly Thermometer 12 degrees above zero Took out 20,000 herring","Boston Harbor",1881,1,-70.97553,42.337638
1881-01-25,"The wind Westerly Thermometer 27 above zero. Took out of the Schr A.G. Brooks 25,600 herring","Boston Harbor",1881,1,-70.97553,42.337638
1881-01-26,"The wind West Thermometer 32 degrees above zeor at Commercial Wharf Took out 33,000 herring out of the vessel which finished the discharginng it being all that was left in yesterday. Towed to the Elevaton in East Boston at dark to take in some corn to be landed at Winter Harbor.","Boston Harbor",1881,1,-70.97553,42.337638
1881-01-27,"Took in 500 bushels of corn in the forenoon and went out for home The wind from teh N. W. blowing heavy. after getting clear from Boston Harbor Two peefed mainsail and foresail and went into Gloucester at 1 P.M. blowing very heavy Thermometer. 15 above 0 anchored in outer part of Harbor","Boston Harbor",1881,1,-70.97553,42.337638
1881-01-27,"Took in 500 bushels of corn in the forenoon and went out for home The wind from teh N. W. blowing heavy. after getting clear from Boston Harbor Two peefed mainsail and foresail and went into Gloucester at 1 P.M. blowing very heavy Thermometer. 15 above 0 anchored in outer part of Harbor","Gloucester",1881,1,-70.66199,42.61593
1881-01-28,"The wind North West and blowing a perfect gale with the Thermometer at zero at Sunrise Made no attempt to get underway Layed at ancher all day in Gloucester vessels came in with broken booms and leed very badly.","Gloucester",1881,1,-70.66199,42.61593
1881-01-29,"The wind still blowing a heavy gale from the North West while the Thermometer at day light was only 4 degrees above zero Layed at anchor allday in Gloucester Harbor","Gloucester",1881,1,-70.66199,42.61593
1881-01-31,"The wind Nort W. by W.Thermometer 12 degrees above in morning at 8 A.M. Got under way and went out and went inside of Thatcher Island to Silvages Wind blowing very heavy. and rough vessel staid  wore ship and reefed down and went back to Gloucester at night more moderate.","Gloucester",1881,1,-70.66199,42.61593
1881-01-31,"The wind Nort W. by W.Thermometer 12 degrees above in morning at 8 A.M. Got under way and went out and went inside of Thatcher Island to Silvages Wind blowing very heavy. and rough vessel staid  wore ship and reefed down and went back to Gloucester at night more moderate.","Thacher Island",1881,1,-70.576309,42.637592
1881-02-01,"The wind North Thermometer 20 degrees at 10 oclock A.M. Went out and got as fas as Silvages The wind inclined Easterly and rough tacked ship and went back into the Harbor of Gloucester.","Gloucester",1881,2,-70.66199,42.61593
1881-02-02,"The wind North North West And a very fresh breeze Thermometer 4 degrees below  zero. and Ice maing over the Harbor  layed allday at anchor without making any attempts to get under way","Gloucester",1881,2,-70.66199,42.61593
1881-02-03,"The wind about North North West Thermometer gone up to 10 above zero, fresh breeze and Easterly rote all day","Gloucester",1881,2,-70.66199,42.61593
1881-02-04,"The wind Northly West and although the Thermometer was only about 20 degrees above we did not make any effort to get under way. as it is reported the Wind was about North North East & very rough.","Gloucester",1881,2,-70.66199,42.61593
1881-02-05,"The wind N by. W. Thermometer 33 Got under way at 8 oclock in the fore noon passed out side of Thatchers Isle and tacked and stood up into Ipswich bay. Thook out reefs and set light sauls & headed to North ward & Eastward at sunset Isles of Shoels bore North about 5 miles distant passed out side of Isle of Shoals took the wind from the Northward & Easward Went into Portsmouth at midnight overcast","Gloucester",1881,2,-70.66199,42.61593
1881-02-05,"The wind N by. W. Thermometer 33 Got under way at 8 oclock in the fore noon passed out side of Thatchers Isle and tacked and stood up into Ipswich bay. Thook out reefs and set light sauls & headed to North ward & Eastward at sunset Isles of Shoels bore North about 5 miles distant passed out side of Isle of Shoals took the wind from the Northward & Easward Went into Portsmouth at midnight overcast","Thacher Island",1881,2,-70.576309,42.637592
1881-02-05,"The wind N by. W. Thermometer 33 Got under way at 8 oclock in the fore noon passed out side of Thatchers Isle and tacked and stood up into Ipswich bay. Thook out reefs and set light sauls & headed to North ward & Eastward at sunset Isles of Shoels bore North about 5 miles distant passed out side of Isle of Shoals took the wind from the Northward & Easward Went into Portsmouth at midnight overcast","Isles of Shoals",1881,2,-70.606830906,42.975496098
1881-02-05,"The wind N by. W. Thermometer 33 Got under way at 8 oclock in the fore noon passed out side of Thatchers Isle and tacked and stood up into Ipswich bay. Thook out reefs and set light sauls & headed to North ward & Eastward at sunset Isles of Shoels bore North about 5 miles distant passed out side of Isle of Shoals took the wind from the Northward & Easward Went into Portsmouth at midnight overcast","Portsmouth",1881,2,-70.762245,43.071568
1881-02-06,"The wind North East Got under way in Portsmouth Schr A. G. Brooks for home. Got out by the Whales back and found it very rough gave it up and went back into Porthsmouth Sun out clean and Thermometer. 35, degrees above zero in the shade.","Portsmouth",1881,2,-70.762245,43.071568
1881-02-07,"The wind N.N. West. and moderate. Got underway at day light. rough outside  Got abrest of York. at 10. A.M. and got becalmed. At two oclock the wind breezed up from South West very moderate and hauled westerly and Northerly at mid night nearby abrest Wood Island and becalmed. So ends these 24 hours.","York",1881,2,-70.6440677808301,43.1621847847379
1881-02-07,"The wind N.N. West. and moderate. Got underway at day light. rough outside  Got abrest of York. at 10. A.M. and got becalmed. At two oclock the wind breezed up from South West very moderate and hauled westerly and Northerly at mid night nearby abrest Wood Island and becalmed. So ends these 24 hours.","Wood Island",1881,2,-70.3332596098111,43.4579679566059
1881-02-08,"Calm or nearly sometill abrest 3 oclock in the afternoon when the wind breezed up South West The Thermometer 45 degrees above in the Shade. Passed Seguin outside at 5 P.M. Passed Monhegan at 8 PM the wind breezed up Passed Owls head at 11.30 P.M. and run for the Northern Head of Fox Island the sky overcast and look like a storm.","Fox Islands",1881,2,-68.8639267338772,44.1465638197881
1881-02-08,"Calm or nearly sometill abrest 3 oclock in the afternoon when the wind breezed up South West The Thermometer 45 degrees above in the Shade. Passed Seguin outside at 5 P.M. Passed Monhegan at 8 PM the wind breezed up Passed Owls head at 11.30 P.M. and run for the Northern Head of Fox Island the sky overcast and look like a storm.","Fox Islands",1881,2,-69.7919898,43.7306406
1881-02-09,"Thermometer midnight Anchored at Northern head of FoxIslands at 2 am at day light got underway for home Wind South West good breeze, and overcast with a little drizzling rain Running thraugh merchants row runinto thick ice and vessel stoped. Lowered boat took her under the bom and out the through ice more tahn one foot thick worked three hours and got  through it with the help of a smart breeze of wind. Went through Long Island head and got home at 4 oclock in the afternoon more maunatu","Fox Islands",1881,2,-68.8639267338772,44.1465638197881
1881-02-09,"Thermometer midnight Anchored at Northern head of FoxIslands at 2 am at day light got underway for home Wind South West good breeze, and overcast with a little drizzling rain Running thraugh merchants row runinto thick ice and vessel stoped. Lowered boat took her under the bom and out the through ice more tahn one foot thick worked three hours and got  through it with the help of a smart breeze of wind. Went through Long Island head and got home at 4 oclock in the afternoon more maunatu","Fox Islands",1881,2,-69.7919898,43.7306406
1881-02-09,"Thermometer midnight Anchored at Northern head of FoxIslands at 2 am at day light got underway for home Wind South West good breeze, and overcast with a little drizzling rain Running thraugh merchants row runinto thick ice and vessel stoped. Lowered boat took her under the bom and out the through ice more tahn one foot thick worked three hours and got  through it with the help of a smart breeze of wind. Went through Long Island head and got home at 4 oclock in the afternoon more maunatu","Long Island",1881,2,-73.3,40.8
1881-02-10,"The wind Southerly commenced taking the corn out of the A.G. Brooks. that was put on board in Boston","Winter Harbor",1881,2,-68.09811741,44.39116851
1881-02-11,"The wind West North West Thermometer 39 degrees at noon in the shade. Finished taking the corn of the Schooner A.G. Brooks.","Winter Harbor",1881,2,-68.09811741,44.39116851
1881-02-12,"The wind East South East commenced making flying fibboon for Schr Lebanon. at 11 commenced snowing and raining went home Thermometer 32 degrees","Winter Harbor",1881,2,-68.09811741,44.39116851
1881-02-13,"The wind from South East to West rainy in forenoon and snow in afternoon Thermometer from 35 in forenoon down to 22 at night","Winter Harbor",1881,2,-68.09811741,44.39116851
1881-02-14,"The wind West North West Thermometer 24 degrees Wrote deed from Enoch Newman to Rufus H and Alexander Bickford","Winter Harbor",1881,2,-68.09811741,44.39116851
1881-02-15,"Wind Westerly Thermometer 29 above Finished the flying fibbon for the Schr Lebanon.","Winter Harbor",1881,2,-68.09811741,44.39116851
1881-02-16,"The wind East South East. Commenced snowing at 9 A.M. and snowed hard until dark at night wind came from North West Work apart of the day in J F Kingsleys shop turning for my self.","Winter Harbor",1881,2,-68.09811741,44.39116851
1881-02-17,"The wind North West Thermometer 20 above Work in the afternoon cutting fire wood","Winter Harbor",1881,2,-68.09811741,44.39116851
1881-02-18,"The wind Southerly Thermometer 28 above zero. Work about home","Winter Harbor",1881,2,-68.09811741,44.39116851
1881-02-19,"The wind Northerly Thermometer 32 degrees At home weighing hay for J. H. Kingsley & JennieTracy.","Winter Harbor",1881,2,-68.09811741,44.39116851
1881-02-20,"The wind very moderate Northerly Thermometer at noon. 37 degrees","Winter Harbor",1881,2,-68.09811741,44.39116851
1881-02-21,"The wind Easterly thermometer at noon 18 degrees above zero. Sent to the Town Clerk to get Mr Joseph Smallidge and Annie hammond Published, aslo in this Town and Town of Deer Isle Daniel McNeal of Gouldsbror and mifs Maria Tracy  Worked apart of the day for H E Tracy on Schr Lebanon","Winter Harbor",1881,2,-68.09811741,44.39116851
1881-02-22,"The wind Westerly Thermometer 35 above Workall day on fore boom for Schr Lebanon. The Sleighnig and sleding to day good as can be.","Winter Harbor",1881,2,-68.09811741,44.39116851
1881-02-23,"The wind Southerly Thermometer 40 above Worked in forenoon for H.E. Tracy and finished making fore boom Inafrernoon went on the head of home lot looking after fire wood at dark commenced raining.","Winter Harbor",1881,2,-68.09811741,44.39116851
1881-02-24,"The wind North West and blowing a very heavy gale all day with thermometer down to zero To cold to work out","Winter Harbor",1881,2,-68.09811741,44.39116851
1881-02-25,"The wind North West and wind very moderate but Thermometer down to zero in the morning and at noon went up to 15 above hauled wood all the afternoon","Winter Harbor",1881,2,-68.09811741,44.39116851
1881-02-26,"The wind North West Thermometer 10 above Went to West Gouldsboro accompanied by wife and child visiting and to see about taus. Stayed all night","Winter Harbor",1881,2,-68.09811741,44.39116851
1881-02-26,"The wind North West Thermometer 10 above Went to West Gouldsboro accompanied by wife and child visiting and to see about taus. Stayed all night","West Gouldsboro",1881,2,-68.09937127,44.46922347
1881-02-27,"The wind Southerly Thermometer 35 degrees above at noon. Went home from West Gouldsboro in afternoon with A Bickford horse","West Gouldsboro",1881,2,-68.09937127,44.46922347
1881-02-27,"The wind Southerly Thermometer 35 degrees above at noon. Went home from West Gouldsboro in afternoon with A Bickford horse","Winter Harbor",1881,2,-68.09811741,44.39116851
1881-02-28,"The wind South by East Thermometer 35 degree about 9 AM commenced to rain, and rained the remaindr of the day, and very late in the night. Reed the certificates of Joseph Smallidge and Daniel MC Neal from Clerk of this town","Winter Harbor",1881,2,-68.09811741,44.39116851
1881-03-01,"The wind East and Thermometer 34 degrees Rained very heavy all day with a fresh breeze Reed the certificate of Daniel MC Neal from the town of Deer Isle. of the Intention of Marriage. Turned caulking mallet for Herbert Tracy","Winter Harbor",1881,3,-68.09811741,44.39116851
1881-03-02,"The wind North East Thermometer 33 degrees above zero; Painted decoys for Thomas Bickford in the forenoon and commenced connecting two Bedrooms at home by putting a door between. Rainy","Winter Harbor",1881,3,-68.09811741,44.39116851
1881-03-03,"The wind Easterly. Thermometer 34 1/2 Went to Capt Nathan Bickfords visiting with my wife & child Snow and rain moderate all day Mary Jane Hammick baby died at 11 P.M.","Winter Harbor",1881,3,-68.09811741,44.39116851
1881-03-04,"The wind Easterly Thermometer 32 degrees snow squalls allday accompanied by rani cased out door cat home.","Winter Harbor",1881,3,-68.09811741,44.39116851
1881-03-05,"The wind Southerly and rough Thermometer 30 degrees above. The first Time shiny day since last Monday.","Winter Harbor",1881,3,-68.09811741,44.39116851
1881-03-06,"The wind NorthNorthEast and pleasant Thermometer 32 degrees above zero","Winter Harbor",1881,3,-68.09811741,44.39116851
1881-03-07,"The wind North Thermometer 43 degrees Started for Town Meeting. Went home and went to puthing up fence.","Winter Harbor",1881,3,-68.09811741,44.39116851
1881-03-08,"The wind Southerly Thermometer 42 degrees above zero at noon Worked 3/4 day for J F kingsley cutting Ice Hee commenced to day to cut ice","Winter Harbor",1881,3,-68.09811741,44.39116851
1881-03-09,"The wind South East Thermometer 37 degrees Worked in the forenoon for J. F Kingsley cutting Ice. At noon was notified that I was chosen a Constable at the annual Town Meeting held last monday. of which i was absent. In the afternoon work for Herbert Tracy putting in piece of wace in his vessel the Lebanon","Winter Harbor",1881,3,-68.09811741,44.39116851
1881-03-10,"The wind Easterly Thermometer 40 above Went on board of the Lebanon to work in the morning. at 9 AM it commenced raining and rained the remainder of the day. Was sworn as Constable by N. Hammond Justice of the Peace and sent the return to S.W. Libby Clerk of the Town of Gouldsboro.","Winter Harbor",1881,3,-68.09811741,44.39116851
1881-03-11,"The wind Easterly and rainy all day Thermometer 38 degrees work in the house fixing it up","Winter Harbor",1881,3,-68.09811741,44.39116851
1881-03-12,"The wind North East Thermometer 33 degrees Snow squalls untill 10 am and cleared up Had a small amount of plastering done in a bedroom in the forenoon and in the afternoon put Stem post in qawel boat of the Lebanon.","Winter Harbor",1881,3,-68.09811741,44.39116851
1881-03-13,"The wind moderate Northerly and sually overcast half of the day Thermometer 40","Winter Harbor",1881,3,-68.09811741,44.39116851
1881-03-14,"The wind East- North East Snow Squalls in the morning. Went to South Gouldsboro and put stem post in boat for C. L. Bunker Clerd of pleasant in forenoon Thermometer at night 35 degrees Walked home in the evening.","Winter Harbor",1881,3,-68.09811741,44.39116851
1881-03-14,"The wind East- North East Snow Squalls in the morning. Went to South Gouldsboro and put stem post in boat for C. L. Bunker Clerd of pleasant in forenoon Thermometer at night 35 degrees Walked home in the evening.","South Gouldsboro",1881,3,-68.109596,44.42952
1881-03-14,"The wind East- North East Snow Squalls in the morning. Went to South Gouldsboro and put stem post in boat for C. L. Bunker Clerd of pleasant in forenoon Thermometer at night 35 degrees Walked home in the evening.","Winter Harbor",1881,3,-68.09811741,44.39116851
1881-03-15,"The wind North East in forenoon and Southerly in afternoon Mixed paint and painted the bedroom","Winter Harbor",1881,3,-68.09811741,44.39116851
1881-03-16,"The wind South East Thermometer 33 degrees Work in the forenoon for H E Tracy. In the afternoon weighed hay for Jennie Tracy","Winter Harbor",1881,3,-68.09811741,44.39116851
1881-03-17,"The wind Easterly Thermometer 38 degrees Wrote bill of sale of Barney Tioso Boat to J Winslow Joues & Co.","Winter Harbor",1881,3,-68.09811741,44.39116851
1881-03-19,"The wind Easterly Thermometer 38 dehrees Weighed hay for Jennie Tracy and worked on my dora","Winter Harbor",1881,3,-68.09811741,44.39116851
1881-03-20,"The wind East South East Thermometer 35 degrees rain and hailstorm all day. Ira B. Tioso captised in afternoon by Mr A .T. Palmer","Winter Harbor",1881,3,-68.09811741,44.39116851
1881-03-22,"The wind Southerly thermometer 42 degrees Work in the forenoon for Capt N.A. Bickford and in the afternoon on my dora Acknowledged deed for Hannoch M Hewman","Winter Harbor",1881,3,-68.09811741,44.39116851
1881-03-23,"Wind North West Thermometer 40 at noon Painted out side of dora in forenoon","Winter Harbor",1881,3,-68.09811741,44.39116851
1881-03-24,"Wind North West Thermometer 42 above made centre box for my dora sold and weighed hay for Chas Smith","Winter Harbor",1881,3,-68.09811741,44.39116851
1881-03-25,"The wind West North West Thermometer 45 degrees mailed nailed centre board box in dora and caulked it made thorts and painted the inside of dora","Winter Harbor",1881,3,-68.09811741,44.39116851
1881-03-27,"The wind West North West Thermometer 28 in morning and went up to 34 in afternoon","Winter Harbor",1881,3,-68.09811741,44.39116851
1881-03-28,"The wind West North West Thermometer 35 degrees Work about home made centre boad for my dora","Winter Harbor",1881,3,-68.09811741,44.39116851
1881-03-29,"Wind Westerly thermometer 41 degrees Took some straw matting and stove out the Hotel","Winter Harbor",1881,3,-68.09811741,44.39116851
1881-03-30,"The wind Easterly & clear Thermometer 45 above 0 Went to the Lower Harbor and filled out the application of Prize mooney for Clarinda H crane Whose late husband Lemul G Crane commanander of the W. S. Steamer Uncur during the Rebellion","Winter Harbor",1881,3,-68.09811741,44.39116851
1881-03-30,"The wind Easterly & clear Thermometer 45 above 0 Went to the Lower Harbor and filled out the application of Prize mooney for Clarinda H crane Whose late husband Lemul G Crane commanander of the W. S. Steamer Uncur during the Rebellion","Winter Harbor",1881,3,-68.09811741,44.39116851
1881-03-31,"The wind East North East blowing and snowing all day thermometer 32 degrees Put straw matting down on bedroom floor at home. Was appointed high way survayer by the Select men for this district","Winter Harbor",1881,3,-68.09811741,44.39116851
1881-04-01,"The wind very moderate Northerly in morning thick with snow. Went on the road and shoveled snow in forenoon wind hauled around Westerly Thermometer 46 taped a pair of boots for my self and worked on dora in afternoon for Geo. Pendleton Signed the quarterly returns for the Birch Harbor Post Master.","Winter Harbor",1881,4,-68.09811741,44.39116851
