"date_mdy","journal_entry","location","year","month","longitude","latitude"
1881-04-02,"The wind West North West fresh breeze Thermometer at noon 38 degrees work in the forenoon for Geo. Pandleton and finished his dora Thermometer at dark 26 degrees In the evening Married Mr Daniel Mc Neal of Gouldsboro and mifs Maria Tracy of Deer Isle.","Winter Harbor",1881,4,-68.09811741,44.39116851
1881-04-03,"The wind West North West Thermometer 35 degrees.. at noon at freezing","Winter Harbor",1881,4,-68.09811741,44.39116851
1881-04-04,"The wind Westerly fresh breeze Thermometer in morning 22 degrees at noon warmer. Work most all day on a gun stock for Llewellyn Pendlton","Winter Harbor",1881,4,-68.09811741,44.39116851
1881-04-05,"Wind west North West Thermometer 40 degrees at noon Work in forenoon making a derick for the Schr A. G. Brooks. and in the afternoon worked on the Brooks repairing","Winter Harbor",1881,4,-68.09811741,44.39116851
1881-04-06,"The wind Westerly Thermometer 32 degrees commenced work in afternoon making fore gaft for Schr Nevada","Winter Harbor",1881,4,-68.09811741,44.39116851
1881-04-07,"Wind North West. Thermometer 42 degrees Finished making gaft for the Nevada in forenoon. Took the oath as highway surveyor of high ways. Lizzi Bunker sells Crow Island to E.A. Baker.","Winter Harbor",1881,4,-68.09811741,44.39116851
1881-04-08,"The wind Westerly Thermometer 30 work in forenoon finishe painting my dora","Winter Harbor",1881,4,-68.09811741,44.39116851
1881-04-09,"The wind South West Thermometer 60 degrees finished the gun stock and launched my dora","Winter Harbor",1881,4,-68.09811741,44.39116851
1881-04-10,"The wind South East and pleasant. thermometer 57 degrees","Winter Harbor",1881,4,-68.09811741,44.39116851
1881-04-11,"The wind Southerly Thermometer 38 degrees Tassed the all gangingCatecued herring net Wrote petition for EA Baker. to the Select Men","Winter Harbor",1881,4,-68.09811741,44.39116851
1881-04-12,"The wind North West in forenoon and South West in afternoon. Work allday on the Schr Ida G. Spafford for Capt James A. Stevens","Winter Harbor",1881,4,-68.09811741,44.39116851
1881-04-13,"Calm in morning then the wind breezed up South East . Thermometer 41 Work all day aboit home on trall","Winter Harbor",1881,4,-68.09811741,44.39116851
1881-04-14,"The wind North East light snow in the morning then turned to drizzling rain Roped dora sail and geting ready to go fishing","Winter Harbor",1881,4,-68.09811741,44.39116851
1881-04-15,"The wind North East. and a perfect gale of wind with snow hail and rain allday. at night the snow not more than three inches deep and raining hard thermometer 32 degrees made net buoys","Winter Harbor",1881,4,-68.09811741,44.39116851
1881-04-16,"The wind West South West Thermometer 44 degrees in the afternoon. Riged trall morings and lined dora sail turned thole pins&c.","Winter Harbor",1881,4,-68.09811741,44.39116851
1881-04-17,"The wind North West and very pleasant Thermometer 50 degrees Stephen Torrey died at 5 oclock in the morning","Winter Harbor",1881,4,-68.09811741,44.39116851
1881-04-18,"The wind North West Thermometer 50 degrees hauled wood from Baker & Smiths store for my self","Winter Harbor",1881,4,-68.09811741,44.39116851
1881-04-19,"The wind North west Thermometer 39 degrees bailed trall ready to go fishing tomorrow Stephan Torrey burried in afternoon a prayer at the house by A.T. Palmer","Winter Harbor",1881,4,-68.09811741,44.39116851
1881-04-20,"The wind Northerly in morning went out fishing for the first time for the season got 9 wind Southerly at noon came home. Thermometer 35 degrees Jennie Hammond burried in afternoon Seruises at the house by A T Palmer","Winter Harbor",1881,4,-68.09811741,44.39116851
1881-04-21,"The wind Southerly in morning and the Termometer below freezing Went to the Lower Harbor claming for bait. The wind came North West and blew fresh put sail on dora and beat home in afternoon the Thermometer 50 above Caused Repairs in cross way in ligh ways","Winter Harbor",1881,4,-68.09811741,44.39116851
1881-04-22,"Calm in morning went out fishing picked the troll twice got 14 fish at noon the wind breezed up South west and came home. Wrote Notice for District meeting in district No. 12 which is at the Lower Harbor Thermometer 37.","Winter Harbor",1881,4,-68.09811741,44.39116851
1881-04-23,"The wind South West and chilly raw Thermometer 42 degrees work on dora for a Mr. Pitlee of Brooklin put in center board","Winter Harbor",1881,4,-68.09811741,44.39116851
1881-04-24,"The wind Southerly Thermometer 41 degrees in forenoon Late in the afternoon wind Westerly and very pleasant and the Thermometer 50.","Winter Harbor",1881,4,-68.09811741,44.39116851
1881-04-25,"The wind North west and pleasant with Thermometer 65 degrees at noon Finished labor on one dora for Mr Petlee of Brooklin and commenced on an other one for his son Filled application for Baker & Smith to cary on business in manufature tobacco. Acknowledged Bill of Sale for A. J. Gerrish Wrote lease from Isaac P Joy to Amasink Southard recd check from the P.O. Department to Cary mail on route 365","Winter Harbor",1881,4,-68.09811741,44.39116851
1881-04-26,"The wind Southerly work allday on dora Thermometer 60","Winter Harbor",1881,4,-68.09811741,44.39116851
1881-04-27,"The wind Easterly Thermometer 49 at noon Went to Bunkers Harbor and bought a set of Chira dishes for Annie Smallidge of Mrs Emma Emerson work on dora in afternoon","Winter Harbor",1881,4,-68.09811741,44.39116851
1881-04-27,"The wind Easterly Thermometer 49 at noon Went to Bunkers Harbor and bought a set of Chira dishes for Annie Smallidge of Mrs Emma Emerson work on dora in afternoon","Bunkers Harbor",1881,4,-68.032890578085,44.3732689930884
1881-04-27,"The wind Easterly Thermometer 49 at noon Went to Bunkers Harbor and bought a set of Chira dishes for Annie Smallidge of Mrs Emma Emerson work on dora in afternoon","Winter Harbor",1881,4,-68.09811741,44.39116851
1881-04-28,"The wind Southerly Thermometer 61 degrees at noon Got Ira B. Foss & A. J. Gerrish to sign my bond as constable Wm Handys note was taken up amount of $ 50 and int","Winter Harbor",1881,4,-68.09811741,44.39116851
1881-04-29,"The wind South East and rainy. Wrote deed for Abbie L Harrington to Mrs D. M. Summer thermometer 38 Left sum noons for Simon J. Angbrews to apeer at a justice Court and answer to Curtis Stevens of Castine","Winter Harbor",1881,4,-68.09811741,44.39116851
1881-04-30,"The wind North West Thermometer 50 work on doras","Winter Harbor",1881,4,-68.09811741,44.39116851
1881-05-01,"The wind Southerly Thermometer 49 not well all day","Winter Harbor",1881,5,-68.09811741,44.39116851
1881-05-02,"Wind South South East and forenoon rainy thermometer 37 degrees not well unable to work.","Winter Harbor",1881,5,-68.09811741,44.39116851
1881-05-03,"The wind North West Thermometer 65 degrees Annie Smallidge moved in one part of the house","Winter Harbor",1881,5,-68.09811741,44.39116851
1881-05-04,"Calm in morning Went to Prospect with the Stage dosee E.W. Cleaves about filling a justice writ to rebion Wind Southerly in afternoon Walked home Thermometer 61 degrees wrote deed from Peleg L Tracy to David Weare.","Winter Harbor",1881,5,-68.09811741,44.39116851
1881-05-04,"Calm in morning Went to Prospect with the Stage dosee E.W. Cleaves about filling a justice writ to rebion Wind Southerly in afternoon Walked home Thermometer 61 degrees wrote deed from Peleg L Tracy to David Weare.","Prospect Harbor",1881,5,-68.02456023,44.41062098
1881-05-04,"Calm in morning Went to Prospect with the Stage dosee E.W. Cleaves about filling a justice writ to rebion Wind Southerly in afternoon Walked home Thermometer 61 degrees wrote deed from Peleg L Tracy to David Weare.","Winter Harbor",1881,5,-68.09811741,44.39116851
1881-05-05,"Wind Westerly and Thermometer 65 degrees above zero Work about home doing various kinds of work","Winter Harbor",1881,5,-68.09811741,44.39116851
1881-05-06,"Wind South East Thermometer 33 moved Geo. Gerrish from the fish house to the one recently bought by Mark Joy. In afternoon made made sink for room occupied by Joseph & Annie Smallidge","Winter Harbor",1881,5,-68.09811741,44.39116851
1881-05-07,"Wind Southerly thermometer 42 degrees work apart of the day setling up sink & building meat chest Helped J.F. Kingsley mark his lamles & c","Winter Harbor",1881,5,-68.09811741,44.39116851
1881-05-08,"Wind South South East Thermometer 52 degrees pleasant","Winter Harbor",1881,5,-68.09811741,44.39116851
1881-05-09,"The wind South Easterly and showery. build fence out of barb wire to step up E.A. Bakers cattle Thermometer 41 degrees","Winter Harbor",1881,5,-68.09811741,44.39116851
1881-05-10,"The wind Southerly Thermometer 49 degrees Sawed out whul barrow side for my self","Winter Harbor",1881,5,-68.09811741,44.39116851
1881-05-11,"The wind South Easterly fogg and rainy apart of the day.","Winter Harbor",1881,5,-68.09811741,44.39116851
1881-05-12,"The wind South East made wheel for Isaacs Joys wheel barrow in forenoon and in the afternoon work for E.A. Baker laying floorin his store Thermometer 52","Winter Harbor",1881,5,-68.09811741,44.39116851
1881-05-13,"Wind moderate Southerly made head for a wheel barrow fo my self Thermometer 58","Winter Harbor",1881,5,-68.09811741,44.39116851
1881-05-14,"The wind Northerly in forenoon Went out fishing and found my hall parted and the most of it lost. Took up the moorings and one end of trace swept for the rest but could not find it. Wind South west in afternoon came home. Mr Timathy Damton burried in afternoon Thermometer 60 degrees brought potatoes out of the cellar to pick our","Winter Harbor",1881,5,-68.09811741,44.39116851
1881-05-15,"The wind South East Thermometer 60 degrees overcast","Winter Harbor",1881,5,-68.09811741,44.39116851
1881-05-16,"Wind North East and afternoon rainy Thermometer 55 degrees work about home all day fresh breeze","Winter Harbor",1881,5,-68.09811741,44.39116851
1881-05-17,"Wind East and blowing a gale with atremendious heavy rain all day with out ceasing Thermometer 50 degrees Commenced rigging trall in place one I lost.","Winter Harbor",1881,5,-68.09811741,44.39116851
1881-05-18,"The wind East North East Thermometer 45 rainy all day fresh breeze Finished rigging my troll.","Winter Harbor",1881,5,-68.09811741,44.39116851
1881-05-19,"Wind East and a gale tremendious rain all day. Thermometer 40 Work apart of the day for Almia Bourgett Wrote Notices for Jennie Tracy warning people to take care of their cattle","Winter Harbor",1881,5,-68.09811741,44.39116851
1881-05-20,"Wind Easterly and heavy rain work apart of the day for my slef on henpan Thermometer 39","Winter Harbor",1881,5,-68.09811741,44.39116851
1881-05-21,"The wind North East Thermometer 42 degrees wind moderate but the rain very heavy work all day on hen pew for my self","Winter Harbor",1881,5,-68.09811741,44.39116851
1881-05-22,"The wind hauled around Northward and in the afternoon sun came out very pleasant. Went to Herm Island to see E.A.Bakers wier. Thermometer 69 degrees.","Winter Harbor",1881,5,-68.09811741,44.39116851
1881-05-23,"very light rain Northerly went out fishing and to sweep for my lost troll but did not get it. Wind Southerly in afternoon and fogy came home but left a new troll out there to catch the lost one.","Winter Harbor",1881,5,-68.09811741,44.39116851
1881-05-24,"The wind South West Thermometer 49 degrees went to Bar Harbor after bait but got none. came back home in the afternoon.","Winter Harbor",1881,5,-68.09811741,44.39116851
1881-05-24,"The wind South West Thermometer 49 degrees went to Bar Harbor after bait but got none. came back home in the afternoon.","Bar Harbor",1881,5,-68.212219,44.387699
1881-05-24,"The wind South West Thermometer 49 degrees went to Bar Harbor after bait but got none. came back home in the afternoon.","Winter Harbor",1881,5,-68.09811741,44.39116851
1881-05-25,"Very moderate in the morning went out to my troll. The wind struck from the North East in a aquall and blowed a gale cast the troll of and came home Thermometer 47 degrees.","Winter Harbor",1881,5,-68.09811741,44.39116851
1881-05-26,"The wind Easterly and hauled around Southerly went out fishing and got my lost troll by hauling it up on the one I was fishing with Thermometer 57 Had organ put in house","Winter Harbor",1881,5,-68.09811741,44.39116851
1881-05-27,"The wind Southerly and fogy went out to my troll fog cleared up about 10 am. Calm in afternon rowed all the way in Thermometer 53 degrees","Winter Harbor",1881,5,-68.09811741,44.39116851
1881-05-28,"The wind North East in morning and hauled around Easterly Southerly and S.W. went out fishing all day. Thermometer at night 49 degrees","Winter Harbor",1881,5,-68.09811741,44.39116851
1881-05-29,"The wind Southerly and in the forenoon very pleasant with the Thermometer 63 In the afternoon cloudy at 4 PM commenced raining","Winter Harbor",1881,5,-68.09811741,44.39116851
1881-05-30,"The wind Southerly Not having any bait did not go to my troll but warked about home Thermometer 65 degrees","Winter Harbor",1881,5,-68.09811741,44.39116851
1881-05-31,"Wind Easterly and thick with fog. Went to my troll with out any bait and took of what fish there was on it. afternoon cleared up with the Thermometer 57 degrees","Winter Harbor",1881,5,-68.09811741,44.39116851
1881-06-01,"Wind Easterly not having any bait did not go to my troll but worked about home","Winter Harbor",1881,6,-68.09811741,44.39116851
1881-06-02,"The wind South East Thermometer 67 degrees Commenced farming done all ploving Recd execution against J. L. Andrews for me to collect as Constable from the Office of Geo M Warren G. Stevens Plaintiff","Winter Harbor",1881,6,-68.09811741,44.39116851
1881-06-03,"The wind Easterly hauled out dressing to plant and harrewed out friell Thermometer 40","Winter Harbor",1881,6,-68.09811741,44.39116851
1881-06-04,"The wind North East fresh breeze and heavy rain all day. work apart of the day on wheel barrow. and examined the papers of Wm. Bunkers for carrying the mail","Winter Harbor",1881,6,-68.09811741,44.39116851
1881-06-05,"The wind Southerly fresh breeze but pleasant Went to So. Gouldsboro with J. F. Kingsley Thermometer 68 degrees","Winter Harbor",1881,6,-68.09811741,44.39116851
1881-06-05,"The wind Southerly fresh breeze but pleasant Went to So. Gouldsboro with J. F. Kingsley Thermometer 68 degrees","South Gouldsboro",1881,6,-68.109596,44.42952
1881-06-05,"The wind Southerly fresh breeze but pleasant Went to So. Gouldsboro with J. F. Kingsley Thermometer 68 degrees","Winter Harbor",1881,6,-68.09811741,44.39116851
1881-06-06,"Wind North West Thermometer 59 Put centre board in boat from Capt Ephrain Alley","Winter Harbor",1881,6,-68.09811741,44.39116851
1881-06-07,"The wind South West work all day farming with J.F.Kingsleys horse and the help of Geo. Gerrish Finished hauling out dressing and planted corn beans & c. Thermometer 50","Winter Harbor",1881,6,-68.09811741,44.39116851
1881-06-08,"The Wind South Easterly and overcast and in the afternoon thick with fog and looked like rain Thermometer 47 degrees Finished planting potatoes","Winter Harbor",1881,6,-68.09811741,44.39116851
1881-06-09,"The wind North by East in forenoon clear and pleasant Work in forenoon on garden. In afternoon wind South East. Went out and took up my troll Thermometer 61","Winter Harbor",1881,6,-68.09811741,44.39116851
1881-06-10,"Wind Easterly with fresh breeze. Filled out Notices and sent them to all Tax payers notifying them of the amount of their tax on high way & the date and place of commencing work my self being the Highway surveyer at night commenced raining Thermometer 57 degrees","Winter Harbor",1881,6,-68.09811741,44.39116851
1881-06-11,"The wind E. S. East and pleasant Thermometer 62 degrees bought of James A Stevens 2 Hds salt and got it a shore finished sewing garden and all farming for the spring Recd letter from J.H.West","Winter Harbor",1881,6,-68.09811741,44.39116851
1881-06-12,"The wind Southerly moderate and pleasant Thermometer 60","Winter Harbor",1881,6,-68.09811741,44.39116851
1881-06-13,"The wind Southerly and in the forenoon thick with fog. Commenced working on the Hoghway on new road my self surveyor. Thermometer 47","Winter Harbor",1881,6,-68.09811741,44.39116851
1881-06-14,"The wind Southerly and thick with fog all day Went to Franklin with Wm Sargents horse to see about going in the Sea Queencame home at night S. C. Pendleton duty sworn surveyor protem untill I got ready to take charge Thermometer 64 degrees","Winter Harbor",1881,6,-68.09811741,44.39116851
1881-06-15,"The wind came off from the North West in the morning. and the fog left. Good fresh breeze. Worked on road all day. from foot of Mr. Newmans Hill to the Post. Office. Thermometer 58","Winter Harbor",1881,6,-68.09811741,44.39116851
1881-06-16,"The wind North West and fresh breeze Thermometer down to 50 degrees. Work on the roads all day. from the Post Office to Amaziah Southards","Winter Harbor",1881,6,-68.09811741,44.39116851
1881-06-17,"The wind South West Work about home Thermometer 59","Winter Harbor",1881,6,-68.09811741,44.39116851
1881-06-18,"The wind So: West Thermometer 55 Work about home Grinding tools getting ready to go to Sullivan to work on the Schr Sea Queen","Winter Harbor",1881,6,-68.09811741,44.39116851
1881-06-19,"The wind Southerly and showery Went to Spetacle Island after bait Thermometer 52","Winter Harbor",1881,6,-68.09811741,44.39116851
1881-06-19,"The wind Southerly and showery Went to Spetacle Island after bait Thermometer 52","Spectacle Island",1881,6,-67.040814,44.920635
1881-06-19,"The wind Southerly and showery Went to Spetacle Island after bait Thermometer 52","Winter Harbor",1881,6,-68.09811741,44.39116851
1881-06-20,"Calm in morning went out fishing and and in the afternon Wind Southerly came home. At night Showery. Thermometer 56 degrees","Winter Harbor",1881,6,-68.09811741,44.39116851
1881-06-21,"The wind North West washed out some Cod fish headed up salt dried trolls nets & c to put away Thermometer 57 degrees","Winter Harbor",1881,6,-68.09811741,44.39116851
1881-06-22,"The wind North West washed out haddock and put fish on the flaker. In the afternoon went with my sister fining up the graves of our Father & Brother. Thermometer 62 degrees","Winter Harbor",1881,6,-68.09811741,44.39116851
1881-06-23,"Wind North West in forenoon Work in forenoon for J. H. Smallidge on front yard fence In the afternoon Wind Southerly work for my self on out building Thermometer 68","Winter Harbor",1881,6,-68.09811741,44.39116851
1881-06-24,"The wind North West in forenoon . Work all day for J. H. Smallidge on Schr A.G. Brooks gawl boat Wind Southerly in the afternoon. Thunder shower Thermometer 72","Winter Harbor",1881,6,-68.09811741,44.39116851
1881-06-25,"Calm in morning Went to W. Gouldsboro to see S. L. Tracy and in the afternoon getting ready to go to Sullivan to work on Schr Sea queen expected to go in her after she is repaired Thermometer at noon 70 degrees Wind Southerly in afternoon","Winter Harbor",1881,6,-68.09811741,44.39116851
1881-06-25,"Calm in morning Went to W. Gouldsboro to see S. L. Tracy and in the afternoon getting ready to go to Sullivan to work on Schr Sea queen expected to go in her after she is repaired Thermometer at noon 70 degrees Wind Southerly in afternoon","West Gouldsboro",1881,6,-68.09937127,44.46922347
1881-06-25,"Calm in morning Went to W. Gouldsboro to see S. L. Tracy and in the afternoon getting ready to go to Sullivan to work on Schr Sea queen expected to go in her after she is repaired Thermometer at noon 70 degrees Wind Southerly in afternoon","Winter Harbor",1881,6,-68.09811741,44.39116851
1881-06-26,"Calm in the forenoon Thermometer 72 degrees At noon the wind breezed up Southerly Started for Sullivan in my dora with tools bedding & c to go on board the Sea queen arrived at Sullivan at 3 1/2 oclock not finding the vessel walked to Franklin to see the owners and learned the vessel had not got back from her trip Then I walked back to Sullivan got there at dark and stoped through the night on board the Steamer Mt Desert","Winter Harbor",1881,6,-68.09811741,44.39116851
1881-06-26,"Calm in the forenoon Thermometer 72 degrees At noon the wind breezed up Southerly Started for Sullivan in my dora with tools bedding & c to go on board the Sea queen arrived at Sullivan at 3 1/2 oclock not finding the vessel walked to Franklin to see the owners and learned the vessel had not got back from her trip Then I walked back to Sullivan got there at dark and stoped through the night on board the Steamer Mt Desert","Franklin",1881,6,-68.225999096,44.585497658
1881-07-02,"Calm in ther forenoon and Wind West South West in the afternoon Got the knees ready to put in at three oclock got in dora and started for home Landed at Hoss shore at 5 and walked home","Winter Harbor",1881,7,-68.09811741,44.39116851
1881-07-03,"Wind Southerly and pleasant","Winter Harbor",1881,7,-68.09811741,44.39116851
1881-07-04,"Celebration day Calm and very pleasant in forenoon and in the afternoon Wind southerly and some very heavy showers","Winter Harbor",1881,7,-68.09811741,44.39116851
1881-07-05,"moderate Westerly in forenoon Went to So. Gouldsboro accompanied by my wife and went to dora to stop on board the Sea Queen the remainder of the week while repairing arrived a little past noon work in the afternoon on the Schr Sea Queen","Winter Harbor",1881,7,-68.09811741,44.39116851
1881-07-05,"moderate Westerly in forenoon Went to So. Gouldsboro accompanied by my wife and went to dora to stop on board the Sea Queen the remainder of the week while repairing arrived a little past noon work in the afternoon on the Schr Sea Queen","South Gouldsboro",1881,7,-68.109596,44.42952
1881-07-09,"Calm in the forenoon and very hot but not having any Thermometer on board caued not Tittl how hot it is. Worked all the forenoon on the vessel and in the afternoon the wind breezed up Southerly. Got in the dora with my wife and started for home. Canded in Hosses Cove and walked home arrived at Sunset.","Winter Harbor",1881,7,-68.09811741,44.39116851
1881-07-10,"The wind Southerly with a very fresh breeze at 4 P.M.  left home for Sullivan went to Fosses shore took the dora and arrived on board the Sea Queen at sunset in Sullivan","Winter Harbor",1881,7,-68.09811741,44.39116851
1881-07-16,"Wind Southerly & overcast Healed the vessel on this beach to clean and coulk the caulkers finished one side. At 2. P.M. vessel floated hauled along side of wharf & at three got in dora and started for home at 4. P.M. heavy rain and blow at 6 PM tremendious rain with a gale of wind southerly with thunder & lightning landed at MartinMyricks at 7 Pm and walked home arrived at dark","Winter Harbor",1881,7,-68.09811741,44.39116851
1881-07-17,"The wind North West heavy breeze left home at 3 P.M. walked up to Martin Myricks shore got in dora and started for Sullivan strong Ebb licle & heavy North West wind arrived on board with Sea Queen at Sullivan at ten oclock P.M.","Winter Harbor",1881,7,-68.09811741,44.39116851
1881-07-24,"Wind Southerly and showery laid in Winter Harbor","Winter Harbor",1881,7,-68.09811741,44.39116851
1881-07-25,"Wind Southerly and thick with fog all day filled water and getting ready to sail","Winter Harbor",1881,7,-68.09811741,44.39116851
1881-07-26,"The wind S.S. East and blowing heavy with heavy rain all day","Winter Harbor",1881,7,-68.09811741,44.39116851
1881-07-27,"Wrote notice for dis. meeting The wind Easterly and thick with fog work at home in the garden the ground very wet. Annie Smallidge moved out of the house Wrote Notice for a Disctrict Meeting by a petition of 5 words","Winter Harbor",1881,7,-68.09811741,44.39116851
1881-07-28,"Wind out Southerly no chance to go away in vessel Staid at home hoed corn beans & c","Winter Harbor",1881,7,-68.09811741,44.39116851
1881-07-29,"Very moderate all day the sun shining by spells but the fog very dence Work all the forenoon on the vessels Yawl boat and in the afternoon painted the vessels wait out side","Winter Harbor",1881,7,-68.09811741,44.39116851
1881-07-30,"Calm all day Fog cleared up a little while in the Harbor made lower pump box for the Sea Queen","Winter Harbor",1881,7,-68.09811741,44.39116851
1881-07-31,"Fog cleared up over the land but thick out side and calm Tried to get out the Harbor but could not","Winter Harbor",1881,7,-68.09811741,44.39116851
1881-08-01,"Wind Southerly and thick with fog underway in the morning and tried to get out but not wind enough to get by the Harpor point and anchored in Sargents cove In the afternoon wind breezed up Southerly Started again to go out got down as far as Neads Island and the fog so thick gave it up and went back and anchored in the Sand cove","Winter Harbor",1881,8,-68.09811741,44.39116851
1881-08-14,"The wind North West and pleasant","Calais",1881,8,-67.282753,45.188042
